title,ingredient_text
Whole Wheat Carrot Cake,"['2 cups whole wheat pastry flour', '2 tsp baking powder', '2 tsp ground allspice', '1 tsp ground ginger', '1/2 tsp salt', '1 cup packed light brown sugar', '1 cup butter, at room temperature', '6 large eggs, beaten', 'Grated zest of 2 oranges', '1 tsp pure vanilla extract', '6 small carrots, peeled and coarsely grated (2 cups)', '1 cup raisins or golden raisins', '8 oz (225g) cream cheese', ""1 cup confectioner's sugar"", '1/4 cup fresh orange juice', 'Two 8 in (20cm) round cake pans']"
Finger Rolls - Perfect for Soup and Sandwich,"['1 egg', '12 cup milk', '14 cup butter', '2 cups bread flour', '1 teaspoon salt', '1 teaspoon sugar', '1 teaspoon fast rising yeast', 'milk', 'salt']"
Calfs Heart With Carrots Recipe,"['1 x calves heart about 750g lightly smoked belly of pork', '1 x calf s foot split down the middle and cut into 4', '350 gm small white onions', '350 gm small new carrots', '50 gm clarified butter', '2 x unpeeled clv garlic', '2 pch sugar', '50 ml cognac or possibly armagnac', '200 ml chicken stock or possibly water', '1 pch nutmeg', '1 x bouquetgarni with plenty of thyme', '1 Tbsp. shredded flat leaved parsley', '1 x salt and freshly grnd pepper']"
Mightyro's Bok Choy-Leek-Noodle Stir Fry,"['3 bok choy, ribs sliced', '1 leek, sliced', '1 (3 ounce) ramen noodles, discard seasoning pack', '12 cup stir-fry sauce (NOTE -- used ""Kittencal\'s Chinese Stir Fry Sauce-inch .)', '2 tablespoons oil (use more if needed)', '12 cup water']"
Veg-Out Enchiladas,"['8 tortillas', '400 g enchilada sauce', '1 large sweet potato, peeled and finely cubed', '1 medium red onion, finely sliced', '1 small zucchini, finely cubed', '100 g button mushrooms, sliced', '2 large tomatoes, chopped', '12 cup light sour cream', '14 cup finely chopped coriander', '12 cup grated tasty cheese']"
Quick Easy Peanut Butter Cookies,"['1 cup creamy peanut butter', '1 cup sugar', '1 egg', '1 teaspoon baking soda']"
Low-Fat Apple-Carrot Casserole,"['6 lg. carrots', '5 lg. Rome', 'York apples', '5 tbsp. sugar', '5 tbsp. flour', '1/2 tsp. nutmeg', '1 tbsp. margarine', '1/2 cup orange juice']"
Marinade for Steak II,"['1/2 cup molasses', '1/2 cup ketchup', '1 tablespoon ground ginger', '1 teaspoon chopped fresh thyme', '1 tablespoon ground black pepper', '1 tablespoon distilled white vinegar', '1 dash hot pepper sauce, or to taste', '1 tablespoon garlic powder']"
Drink Your Tiramisu!,"['1 cup fresh brewed espresso', '1 tablespoon golden granulated sugar', '1 tablespoon amaretto liqueur', '4 tablespoons mascarpone cheese', '1 tablespoon milk', '12 teaspoon vanilla', '1 tablespoon superfine sugar', 'chocolate shavings']"
Chickpea and Millet Nut Roast,"['100 g millet (200ml water)', '400 g chickpeas (or dried chickpeas)', '1 teaspoon marmite or 1 teaspoon soy sauce', '1 vegetable stock cube', '75 g roasted sunflower seeds (without shells)', '75 g non-salted peanuts (roughly ground)', '25 g dried chopped cranberries (optional)', '2 garlic cloves', '1 medium onion (finely chopped)', '2 tablespoons freshly chopped parsley (or dried parsley)', '1 teaspoon freshly chopped basil (or dried)', '1 teaspoon fennel seed', '1 pinch chili powder', '2 tablespoons olive oil', '1 teaspoon lemon juice', '1 teaspoon brown sugar', '12 teaspoon wine vinegar', '50 g breadcrumbs', '3 tablespoons warm water', 'salt and pepper']"
La Brea Starter and Rustic Bread,"['2 cups bread flour, plus', '3 cups bread flour, for feeding', '2 12 cups tepid tap water, plus', '3 cups tepid tap water, for feeding', '12 lb stemmed red grapes', 'cheesecloth', '7 cups bread flour', '2 cups bread, starter', '3 tablespoons milk', '1 cup tepid tap water (or more)', '3 tablespoons olive oil, plus some for the bowl', '1 package dry active yeast or 1 12 tablespoons dry active yeast', '1 tablespoon salt']"
New Years Oatmeal,"['1 cup Milk', '1/2 cups Quick Cook Oats', '1 teaspoon Light Brown Sugar', '2 Tablespoons Chopped Walnuts', '1 Tablespoon Raisins', '1/4 teaspoons Cinnamon', '1/2 Banana, Peeled And Sliced']"
Carrot Candy,"['8 medium carrots (about 1 pound)', '1 tablespoon olive oil', '1/2 teaspoon salt', '1/2 teaspoon cumin, optional', '1 pound carrots peeled, cut in 1/2"" chunks', '1 cup sugar plus more for sprinkling', '23 cup orange juice', '1/4 cup lemon juice', '2 teaspoons ginger ground', '1/2 teaspoon cinnamon ground']"
Butternut Squash With Chestnuts Recipe,"['2 lb butternut squash rinsed (1 whole or possibly a piece)', '4 c. fat-skimmed chicken broth', '1/3 c. peeled garlic cloves', '1/4 c. sherry vinegar', '1/2 tsp dry rosemary', '1/2 lb fresh shiitake mushrooms stems discarded', '1/4 c. butter or possibly margarine - (1/8 lb)', '2 c. peeled cooked chestnuts (see below) (or possibly a 10-ounce can water-packed chestnuts, liquid removed) Salt to taste Freshly-grnd black pepper to taste']"
Ripe Grape Pie,"['2 1/2 cups seedless grapes', '3 tablespoons melted butter', '2 tablespoons all-purpose flour', '3/4 cup white sugar', '1 recipe pastry for a 9 inch double crust pie']"
Salmon Drops or Salmon Patties,"['15 12 ounces salmon (1 can)', '1 egg, slightly beaten', '12 cup flour', 'pepper', '1 teaspoon baking powder (heaping)', 'cooking oil (optional)']"
Diet Cream Soup Base,"['3 1/2 tablespoons milk instant powder', '1 1/2 tablespoon cornstarch', '1 1/4 cup water cold', '8 ounces tomato sauce can', '3 tablespoons onions chopped', '1 x rosemary leaves dried, crumbled', '1 x black pepper freshly ground, to taste', '1 x cayenne pepper to taste']"
"Roasted Sweet Potato, Lime and Chipotle Soup with Sweet Potato Chips","['3 pounds yams or sweet potatoes, peeled and cut into 1inch pieces', '1 yellow onion, peeled and quartered', '1/2 bunch chopped fresh thyme', '1/4 bunch chopped fresh sage', '2 tablespoons olive oil', '1 teaspoon coarse salt', '4 to 5 cups chicken stock', '4 dried chipotle chiles, stemmed and seeded', 'Juice of 2 limes', '1 tablespoon brown sugar', 'Pinch nutmeg', 'Cracked black pepper to taste', '1/2 cup cream', '1 bunch green onions, sliced thin (optional garnish)', '12 sweet potatoes', '1 pint peanut oil', 'Salt to taste', '2 cups heavy cream', '1/4 cup buttermilk']"
Fresh Tomato-Pesto Pizza,"['Pesto:', '4 cups basil leaves', '2 garlic cloves', '1/4 cup fat-free, less-sodium chicken broth', '1 tablespoon grated fresh Parmesan cheese', '1 tablespoon olive oil', 'Pizza:', '1 (1-pound) Italian cheese-flavored pizza crust (such as Boboli)', '3 cups chopped seeded tomato (about 2 pounds)', '3 garlic cloves, thinly sliced', '1 cup (4 ounces) shredded provolone cheese', '1/4 cup thinly sliced basil leaves', '14 cup reduced-sodium fat-free chicken broth', '1 tablespoon grated fresh parmesan cheese', '1 (1 lb) italian cheese-flavored pizza crust (such as Boboli)', '3 cups chopped seeded tomatoes (about 2 pounds)', '1 cup shredded provolone cheese', '14 cup thinly sliced basil leaves']"
Christmas Jello,"['1 (3 ounce) package lime gelatin', '1 cup crushed pineapple, well drained', '12 cup mayonnaise', '1 (8 ounce) package cream cheese', '12 cup chopped nuts', '1 (3 ounce) package strawberry gelatin', '1 box lemon Jell-O gelatin', '12 cup red cinnamon candies', '2 cups hot water', '2 cups applesauce', '1 dash salt', '3 ounces cream cheese', '12 cup chopped pecans', '1 tablespoon lemon juice']"
Choucroute of Fish,"['8 tablespoons (1 stick) butter', '2 cups rye-bread cubes', '1 pound sauerkraut, rinsed and drained', '4 ounces chopped smoked ham or slab bacon', '1 teaspoon juniper berries, crushed', '1 teaspoon caraway seeds', '1 teaspoon fresh thyme, or 1/2 teaspoon dried', '3 bay leaves', '1 cup white wine, not necessarily bone-dry', '1/2 to 3/4 pound white-fleshed fillet, like halibut', '1/2 to 3/4 pound smoked trout or haddock', '1/2 to 3/4 pound skinned salmon', 'Salt and pepper', '1 shallot, minced', '1/2 cup cream', 'Juice of 1 lemon', 'Chopped fresh parsley for garnish']"
Mushrooms a la Gill,"['2 cups uncooked macaroni pasta', '1 (10.75 ounce) can condensed cream of mushroom soup', '1/2 (10.75 ounce) can milk', '1/2 (10.75 ounce) can water', '1/4 cup sliced fresh mushrooms', 'salt and pepper to taste']"
Lynnes Famous Pork Tenderloin,"['1/2 cups Red Wine', '4 Tablespoons Brown Sugar', '4 Tablespoons Honey', '2 teaspoons Cinnamon', '2 cloves Crushed Garlic', '4 bulbs Shallots, Minced', '2 whole Pork Tenderloins']"
"Baked Apples with Toffee, Bourbon and Molasses","['6 7- to 8-ounce Golden Delicious apples', '6 tablespoons toffee bits (such as Skor)', '3 tablespoons bourbon', '3 tablespoons unsalted butter', '1 1/2 cups apple cider', '3 tablespoons mild-flavored (light) molasses', '1 tablespoon sugar', '1/4 teaspoon ground ginger', 'Vanilla ice cream']"
Coast Toast,"['1 loaf soft French bread (sliced diagonally, about 1 1/2-inch thick)', '1 quart whipping cream', '10 eggs', '34 cup orange juice', '12 cup sugar', '1 pinch salt', '2 tablespoons vanilla', '2 tablespoons orange flavoring']"
Valentine Conversation Heart Bark,"['18 ounces white chocolate chips', '1 12 cups conversation candy hearts']"
Honey Roasted Carrots,"['2 bunches Fresh Carrots (approximately 12 Medium Carrots)', '1 teaspoon Olive Oil', '1 teaspoon Honey', 'Salt And Pepper, to taste', '2 lbs fresh carrots, trimmed, very young work best but can use baby cut carrots', '14 cup honey', '2 tablespoons butter', '12 teaspoon salt', '18 teaspoon cayenne pepper', '8 carrots, peeled', '3 tablespoons olive oil', '1/4 cup honey', 'salt and ground black pepper to taste']"
Chicken And Asparagus Pastries,"['4 ready rolled puff pastry sheets', '1 cup chicken, cooked and chopped', '1 can asparagus, drained or 12 cup fresh asparagus, cooked and chopped', '2 tablespoons sour cream', '2 tablespoons chopped fresh chives (, these may be substitued with chopped spring onions)', '50 g tasty cheese, finely chopped or grated', 'salt and pepper', '1 egg, lightly beaten']"
Steak Tacos Recipe,"['1 lb (4 pc 4oz) New York Steak (or other preferred cut) cut about 1/2"" thick', '24 small corn tortillas', '1/4 lb unsalted butter', '1/2 cup smashed avocado (see my recipe)', '6 tsp chimichurri (see my recipe)', '6 tsp marinated red onion (see my recipe)', 'limes for garnish']"
Bouranee Baunjaun ( Eggplant with Yoghurt Sauce ),"['4 medium eggplant', '1 x salt', '1 x vegetable oil for frying', '2 medium onions sliced', '1 each green bell peppers seeded, sliced', '2 large tomatoes ripe, peeled', '1/4 teaspoon hot chili peppers', '1/4 cup water', '2 cups yogurt drained', '2 each garlic cloves', '1 x salt to taste']"
Tailgate Turkey Chili,"['1 Tablespoon Olive Oil', '1 whole Yellow Onion, Chopped', '5 cloves Garlic, Minced', '2 pounds 99% Fat Free Ground Turkey', '1 can (28 Oz. Size) Crushed Tomatoes', '1 can (15 Oz. Size) Petite Diced Tomatoes', '3 Tablespoons Tomato Paste', '1/2 teaspoons Hot Sauce', '1 can (15 Oz. Size) Kidney Beans, Drained And Rinsed', '1 whole Red Bell Pepper, Stem And Seeds Removed Then Chopped', '1 whole Green Bell Pepper, Stem And Seeds Removed, Then Chopped', '2 whole Jalapenos, Stem And Seeds Removed Then Chopped', '1- 1/2 teaspoon Sea Salt', '1 pinch Pepper', '1 envelope Stevia (individual Size Packet)', '3 Tablespoons Chili Powder', '2 teaspoons Dried Oregano', '18 teaspoons Cayenne Pepper']"
Mushroom and Shoyu Gougere,"['60 g plain flour', '50 g butter, cut into small pieces', '1 pinch salt and pepper', '2 eggs, beaten', '150 ml cold water', '60 g grated cheddar cheese or 60 g gruyere', '1 medium onion, sliced and chopped', '250 g mushrooms, sliced', '1 tablespoon flour', '2 tablespoons shoyu (rich soy sauce)', '1 tablespoon chopped fresh parsley', '1 tablespoon chopped walnuts']"
Herb Spiked Ricotta Galettes,"['8 ounces puff pastry, thawed', '1 cup ricotta cheese', '12 cup grated parmesan cheese', '1 egg, beaten', '2 tablespoons fresh snipped chives', '1 tablespoon chopped fresh thyme', '1 pinch freshly grated nutmeg', 'olive oil', 'salt and pepper']"
Lasagna With Homemade Bolognese Sauce,"['4 clove Garlic', '1 large Whole Carrots', '1 large Celery Stalk', '1 medium White Onion', '2 tbsp Olive Oil', '2 tbsp Italian Seasoning', '1 tbsp Paprika', '1 tbsp Ground Black Pepper', '1 tsp Kosher Salt', '1/4 tsp Rosemary Powder', '2 dash White Pepper', '1 dash Cayenne Powder', '2 lb Lean Ground Beef', '1 lb Ground Italian Sausage', '6 oz Can of Tomato Paste', '28 oz Can of Tomato Puree', '2 cup Red Wine', '2 tbsp Better Than Bullion - Beef', '1 tbsp Worcestershire Sauce', '1 tbsp Balsamic Vinegar', '2 Whole Bay Leaves', '32 oz Ricotta Cheese', '8 oz Cream Cheese', '1 1/2 cup Whole Milk', '1 tbsp Garlic Puree', '1 tbsp Italian Seasoning', '1 tsp Ground Black Pepper', '1/2 tsp Kosher Salt', '6 oz Fresh Grated Parmesan Cheese', '5 cup Grated Mozzarella Cheese', '16 oz Lasagna Noodles']"
Braised Orange BBQ Ribs,"['2-3/4 lb. country-style pork ribs (about 6 ribs)', '1/4 tsp. pepper', '1 Tbsp. oil', '1 small onion, thinly sliced', '1 can (14-1/2 oz.) beef broth', ""1/2 cup BULL'S-EYE Spicy Hot Barbecue Sauce"", '3 Tbsp. KOOL-AID Orange Flavor Sugar-Sweetened Drink Mix']"
Mediterranean Chicken and Potato Salad,"['1 lb boneless skinless chicken breast', '1 garlic clove, peeled', '1 anchovy fillet, rinsed and patted dry', '12 teaspoon salt', '12 cup fresh parsley, chopped', '13 cup nonfat plain yogurt', '14 cup reduced-fat mayonnaise', '12 green olives, pitted and finely chopped', '1 tablespoon capers, drained rinsed and chopped', '1 tablespoon balsamic vinegar', '2 teaspoons Dijon mustard', '12 teaspoon fresh ground black pepper', '1 lb yukon gold potatoes or 1 lb red potatoes, cooked peeled and sliced', '1 12 cups cherry tomatoes, cut in half', '1 lb boneless skinless chicken breast, trimmed and poached', '1 12 cups cherry tomatoes, halved']"
Quick and easy apple cider,"['2 apples', '1 other apple', '3 dash ground nutmeg', '4 dash ground cinnamon', '1 stick of cinnamon', '2 cup water', '1/4 cup ice', '1 honey']"
Great strawberry glaze,"['1 quart strawberries', '1/4 cup sugar', '1/4 cup water', '1 lemon zested and juiced', '1 tbsp corn starch']"
Honey Oatmeal Breakfast Cookies,"['1 cup whole wheat flour', '1 12 cups old fashioned oats', '14 cup vanilla protein powder', '12 teaspoon baking soda', '12 teaspoon baking powder', '1 tablespoon cinnamon', '12 teaspoon nutmeg', '12 teaspoon salt', '12 cup honey', '12 cup unsalted butter, room temperature', '1 tablespoon maple syrup', '2 large eggs', '1 teaspoon vanilla extract', '1 cup raisins', '1 cup walnuts']"
Rocky Mountain Ginger Crisp by Cheri Loughlin,"['1 part premium whiskey', '12 part hiram walker gingerbread liqueur', '1 12 part apricot nectar', '1 12 part sparkling sake']"
Veggie Enchiladas,"['2 green peppers, chopped', '2 small onions, chopped', '6 tablespoons salad oil', '1 (6 ounce) can tomato sauce', '1 (15 ounce) can tomatoes', '2 tablespoons chili powder', '12 ounces sharp cheddar cheese', '1 head lettuce', '1 (12 ounce) package corn tortillas', '5 tablespoons unsalted butter, divided', '5 tablespoons vegetable oil', '12 corn tortillas', '1 onion, minced', '4 cups unpeeled zucchini, grated', '34 cup black olives', '1 (4 ounce) candiced mild green chilies', 'minced garlic', '1 can reduced sodium black beans', '2 cups monterey jack cheese, grated', '20 fluid ounces homemade enchilada sauce (""or"" canned equivalent)', '1 12 cups cheddar cheese, grated']"
Double-Banana Pound Cake,"['Cooking spray', '3 tablespoons dry breadcrumbs', '3 cups all-purpose flour', '1 teaspoon baking powder', '1/4 teaspoon salt', '1/4 teaspoon ground mace', '1 cup mashed ripe banana', '1/2 cup fat-free milk', '1/2 cup banana liqueur', '3/4 cup butter or stick margarine, softened', '2 cups granulated sugar', '1 1/2 teaspoons vanilla extract', '3 large eggs', '1 tablespoon powdered sugar', 'cooking spray', '14 teaspoon salt', '14 teaspoon ground mace', '12 cup nonfat milk', '12 cup banana liqueur', '34 cup butter or 12 cup margarine, softened', '1 12 teaspoons vanilla extract']"
Tuna Rice a Roni Casserole,"['1 (7 ounce) package chicken rice-a-roni', '1 (6 1/2 ounce) can tuna, flaked', '12 small onion', '1 (10 ounce) can cream of mushroom soup', '1 (10 ounce) can cream of chicken soup', '1 (4 ounce) can mushrooms']"
Velvety Pasta With Chicken and Mushrooms,"['12 ounces al dente pasta', '1 12 lbs boneless skinless chicken breasts or 1 12 lbs chicken thighs, cubed', '12 teaspoon salt', '2 tablespoons olive oil', '1 lb mushroom, sliced', '1 large onion, chopped', '12 cup dry sherry', '1 cup chicken broth', '6 ounces cream cheese', '12 cup sun-dried tomato packed in oil, slivered']"
Pimento Mac and Cheese,"['1 lb macaroni (try something other than elbow!)', '14 ounces pimento cheese (regular or jalepeno)', '14 cup margarine (Brummel & Brown)', '13 cup flour', '2 cups milk', 'salt and pepper', 'bacon crumbles and fine breadcrumbs']"
Coyote Margarita,"['1 12 tablespoons superfine sugar', '3 tablespoons lime juice', '1 12 ounces tequila', '1 teaspoon triple sec']"
Easy Stove Top Baked Beans,"['13 cup sauted onion', '2 (15 ounce) cans pork and beans', '14 cup brown sugar', '14 cup molasses', '14 cup ketchup', '1 dash dry mustard']"
Italian Bean Soup from Miserly Moms,"['1 cup dried great northern beans', '1 cup dried red kidney beans', '1 (28 ounce) can tomatoes, cut up', '1 medium onion, chopped', '2 tablespoons beef bouillon granules', '2 garlic cloves, minced', '2 teaspoons italian seasoning, crushed', '14 teaspoon black pepper', '1 (9 ounce) packagefrozen Italian cut green beans']"
Perfect When the Weather's Hot! Spicy Chilled Miso Soup,"['1/2 Cucumber (thinly sliced)', '2 Cherry tomatoes (quartered)', '40 grams Canned tuna', '200 ml Plain cooked rice', '1 dash Toasted white sesame seeds and salt', '1 tsp Sesame oil', '200 ml Bonito dashi stock', '1 tsp Miso', '1/3 tsp Doubanjiang']"
Brigitte's Shrimp Or Tuna Mousse Recipe,"['2 Tbsp. Mayonnaisse', '1/2 c. Water', '1 can Tomato soup', '1 pkt 8 ounce cream cheese', '1 tsp Paprika', '1 lb Shrimp or possibly 2 sm cns tuna', '1/4 c. Peppers, finely minced', '1/2 c. Celery, finely minced', '1 Tbsp. Onion, grated', '1 tsp Worchestershire Sauce', '1/4 tsp Salt', '1 pkt Unflavored gelatin in Water as directed']"
Mike's Granola,"['1 13 cups water', '13 cup canola oil', '12 cup maple syrup', '1 tablespoon vanilla', '8 cups rolled oats', '14 cup oat bran', '14 cup millet', '14 cup sunflower seeds', '14 cup sesame seeds', '1 cup shredded coconut', '1 cup walnuts, chopped', '1 cup pecans, chopped', '1 cup almonds, chopped', '12 cup brown sugar', '1 teaspoon salt', '2 teaspoons cinnamon', '1 12 cups raisins']"
Pesto Tortellini Salad,"['13 cup oil & vinegar salad dressing (store bought)', '3 tablespoons basil pesto (Classico works well)', '1 (350 g) package cheese tortellini (Oliveiri tri-colour)', '4 ounces cheddar cheese, cubed', '12 cup stuffed green olive', '12 pickled pepperoncini peppers', '12 cup cherry tomatoes, halved (optional)', '1 package (10 Oz. Size) Frozen Cheese Tortelinni', '1 jar (6.5 Oz. Size) Pesto With Basil (or You Can Use Homemade)', '1 cup Grape Tomatoes', '1 jar (6.5 Oz. Size) Marinated Artichoke Hearts', '6 ounces, weight Fresh Mozzarella Cheese, Cubed', '1 lb frozen cheese tortellini', '1 (1/2 ounce) packageknorr pesto sauce mix', '12 cup water', '14 cup olive oil', '12 cup pine nuts, toasted', '1 cup mayonnaise (to taste)', '12 cup grated parmesan cheese (to taste)', '1 lb tortellini (Pesto filling best)', '1 cup chopped fresh broccoli', '1 cup chopped fresh carrot', '12 cup chopped fresh red onion', '1 cup mayonnaise', '2 cups fresh basil (un-packed)', '2 tablespoons pine nuts', '12 cup olive oil', '1 garlic clove', 'salt and pepper', '2 pkg. (9 oz.) refrigerated cheese tortellini, cooked, cooled', '1 jar (7 oz.) roasted red peppers, drained, finely chopped', '1/2 cup KRAFT Shredded Italian* Five Cheese Blend', '1/4 cup sliced black olives', '3/4 cup CLASSICO Traditional Basil Pesto Sauce and Spread', '9 ounces cheese tortellini, uncooked', '1 medium zucchini, cut in half lengthwise and sliced', '1 cup grape tomatoes, cut into halves', '13 cup mayonnaise', '14 cup basil pesto', '1 garlic clove, minced', '14 walnuts, chopped and toasted']"
Tacos Wrapidos,"['1 (4 1/3 ounce) packagequick cooking Spanish rice', '1 lb lean ground beef', '1 teaspoon fajita seasoning mix', '4 (10 inch) flour tortillas', '1 avocado, cut into 8 slices', '1 cup shredded cheddar cheese', '1 cup shredded lettuce', '12 cup diced tomato']"
Mushroom and Fontina Quiche,"['1 refrigerated pie crust (half of 15-ounce package)', '2 tablespoons (1/4 stick) butter', '2/3 cup chopped shallots (about 3 medium)', '5 cups sliced assorted mushrooms (such as chanterelle, stemmed shiitake, oyster, crimini, and button; 12 to 14 ounces), large mushrooms halved', '4 large eggs', '2/3 cup half and half', '1/3 cup whole milk', '1/2 teaspoon salt', '1/2 teaspoon freshly ground black pepper', '1/2 teaspoon freshly grated or ground nutmeg', '1 1/2 cups (packed) coarsely grated Fontina cheese (about 7 ounces), divided']"
Chunky Chicken Apple Salad,"['6 ounces cooked chicken breasts', '3 tablespoons pecans, chopped (or walnuts)', '1 medium apple, finely diced', '14 cup celery, chopped', '14 cup mayonnaise', '14 teaspoon lemon juice', 'salt and pepper, to taste']"
Pickled Daikon Radish with Shiso,"['1 Daikon radish', '1 Shio-kombu', '1 Salt-preserved shiso berries or shiso leaves']"
Easy Microwave Custard Made with Whole Eggs,"['15 grams Cake flour', '50 grams Sugar', '1 Whole egg', '200 ml Milk', '1 few drops Vanilla extract', '20 grams Chocolate bar', '1 Bread dough recipe']"
Pan Seared Turkey Chops,"['6 turkey chops', '2 tablespoons olive oil', '2 tablespoons ground pepper', '2 tablespoons onion powder', '2 tablespoons garlic salt', '2 tablespoons chili powder', '1 teaspoon parsley, seasoning', '1 tablespoon paprika', '1 tablespoon salt', '1 pinch cayenne pepper', '1 teaspoon celery salt']"
Make it don't buy it: hummus,"['1 380g carton chick peas in water', '1 tbsp tahini', '2 cloves garlic, crushed', '1 Freshly squeezed juice of one lemon', '1 tsp sea salt', '1 tbsp olive oil', '2 tsp finely chopped flat-leaf parsley', '1 tbsp extra-virgin olive oil (to garnish)']"
Chinese Congee( Zhou),"['1/2 cup rice(I used short grain)', '1 cup water', '1 cup Chicken Stock( you can use beef if you like)', '1 Meat of your choice ; shredded or cut up into pieces', '1 Vegetables: I recommend using either cabbage or mushrooms.( I used cabbage for this recipe)', '1 Thousand year old eggs( pi dan) (This is what you would find in most congee prepared in takeout/resturant places)']"
Spiced Pear Layered Dessert - K,"['1 (14 1/2 ounce) package gingerbread mix', '2 eggs (see NOTE)', '1 cup water (see NOTE)', '2 12 cups cold milk', '2 (3 1/2 ounce) packages instant vanilla flavor pudding and pie filling', '12 teaspoon ground cinnamon', '1 (8 ounce) containerfrench whipped topping, thawed, divided', '2 (16 ounce) canssliced pears, drained']"
Crisp Onion Burger,"['1 pound onions, sliced 1/8-inch thick', '1 cup seasoned all-purpose flour', 'Vegetable oil, for frying', 'Kosher salt and freshly ground black pepper', '2 pounds ground beef, 80/20 blend', '2 tablespoons grapeseed oil', '2 cups French fries', '2 tablespoons softened butter, unsalted', 'Four 4 1/2-inch brioche buns', '1 1/2 cups shredded lettuce', '1/2 cup Thousand Island dressing']"
Acorn Squash & Cranberry-orange Sauce,"['2 acorn squash', '1 (16 ounce) can cranberry sauce', '14 cup orange marmalade', '14 cup raisins', '14 teaspoon cinnamon', 'salt and pepper']"
Bacon Cider Sauteed Collard Greens/Honey Mustard Drizzle,"['12 slices apple-smoked bacon, chopped', '2 bunches collard greens, center stems removed', '1 onion, thinly sliced', 'coarse black pepper (4 turns)', '14 cup apple cider vinegar', '12 cup honey', '12 cup coarse grain mustard', '12 teaspoon Tabasco sauce', '2 tablespoons lemon juice']"
Armenian Pumpkin and Lamb Stew,"['3 lbs pumpkin, roasted, peeled & cut into chunks', '12 teaspoon coriander seed', '12 teaspoon cardamom seed', '12 teaspoon cinnamon, ground', '1 teaspoon cumin seed', '1 clove', '2 tablespoons vegetable oil', '2 lbs lamb, cubed, cut into 2-inch chunks', '1 onion, peeled and minced', '4 garlic cloves, peeled and minced', '2 carrots, peeled and chopped', '1 celery root, peeled and chopped', '4 large red ripe tomatoes, peeled, cored and seeded', '2 quarts chicken broth or 2 quarts beef broth', '1 cup basmati rice, uncooked', '12 teaspoon salt', '1 teaspoon black pepper, freshly ground', '14 cup coriander leaves, minced', '34 cup fresh parsley leaves, minced']"
Mung Dal with Black Mustard Seeds,"['1 cup mung beans yellow, split', '1/4 teaspoon turmeric', '1/2 teaspoon ginger fresh, grated', '1 teaspoon salt', '2 teaspoons lemon juice', '3 tablespoons ghee (clarified butter)', '1/2 teaspoon mustard seeds, black', '1 each green chili peppers seeded and shredded or, 1/4 ts black pepper', '2 tablespoons cilantro chopped']"
Easy Curry,"['500 g beef (diced and lean)', '2 teaspoons oil', '1 apple (diced)', '1 medium onion (diced)', '3 carrots (chopped into chunks)', '2 teaspoons curry powder', '1 tablespoon gravy, powder', '1 cup water', '2 large potatoes (peeled and chopped)']"
"Danish ""Frikadeller"" Meat Patties","['Danish ""fars"" Meatballs (this is a separate posting on recipezaar (recipe 12638))', '4 ounces butter or 4 ounces margarine']"
