title,ingredient_text
Chicken Curried Fried Rice,"['2 cups rice (cooked, and a day old)', '13 cup chicken (cooked)', '14 cup onion', '14 cup green pepper', '12 cup peas', '1 teaspoon garlic (CHOPPED)', '12 teaspoon salt', '1 teaspoon chicken bouillon', '2 teaspoons curry powder', '2 teaspoons Worcestershire sauce', '1 tablespoon vegetable oil']"
Vietnamese Sugar Cured Beef Salad,"['1 (500 g) rump steak or 1 (500 g) rib steak fillets', '2 tablespoons dry sherry', '200 g lump sugar', '1 tablespoon coriander seed', '1 tablespoon white peppercorns', '1 tablespoon sea salt', '2 tablespoons fish sauce', '2 tablespoons water', '1 garlic clove, crushed', '1 small hot chili pepper, seeded and finely chopped', '2 tablespoons lime juice', '1 tablespoon sugar', '12 cup fresh coriander leaves', '12 cup mint leaf', '14 cup vietnamese mint leaf (optional)', '1 cup bean sprouts', '1 lebanese cucumber, sliced', '100 g rice vermicelli, soaked in boiling water']"
Rice N' Peach Salad,"['1 12 cups cooked Minute brown rice', '1 (11 ounce) can whole kernel corn, drained', '1 cup almonds, toasted and chopped', '1 cup frozen peas, thawed', '1 peach, peeled, coarsely chopped', '12 cup kraft Catalina dressing', '14 cup chopped red onion', '14 cup cilantro, chopped']"
Mayonnaise Biscuits (Cookies),"['500 g flour', '250 g sugar', '250 ml mayonnaise', '1 teaspoon vanilla bean paste', '1 teaspoon baking powder', '18 teaspoon salt', '12 cup sugar, extra']"
How to Preserve Butter,['1 block Butter']
Company's Comin' Breakfast Casserole,"['8 slices bread', '8 eggs', '23 cup Velveeta cheese', '4 cups milk', '1 teaspoon salt', '14 teaspoon dried mustard', '1 dash pepper', '1 lb browned and drained sausage']"
Low Calorie Banana Pudding Cheesecake,"['34 cup graham cracker crumbs', '3 tablespoons melted butter or 3 tablespoons margarine', '14 teaspoon cinnamon', '14 teaspoon nutmeg', '8 ounces low-fat cream cheese, softened', '2 cups skim milk, cold', '1 (3 1/2 ounce) box sugar-free fat-free banana cream pudding mix']"
Banana Pudding cake,"['1 box yellow cake mix', '2 tbsp banana extract', '1 box 3.4 banana pudding mix', '1 1mashed banana', '1 1/2 cup milk', '3 eggs', '1/2 cup vegetable oil', '1 box 3.4 instant banana pudding mix', '1 cup milk', '1 cup cool whip', '1 10.6 oz real cream cheese cool whip frosting']"
Coconut Pad Thai,"['1/2 cup raw almond butter*', '2 tablespoons fresh lemon juice', '2 tablespoons pure maple syrup', '1 tablespoon soy sauce', '1 tablespoon minced peeled fresh ginger', '2 garlic cloves, minced', '1 tablespoon minced serrano chile with seeds', '1 to 2 tablespoons water', '1/2 7-ounce block tamarind with seeds**', '2 tablespoons soy sauce', '2 tablespoons extra-virgin olive oil', '2 teaspoons minced peeled fresh ginger', '1 cup (packed) very thinly sliced Napa cabbage', '1/2 cup chopped fresh cilantro', '1 teaspoon fresh lime juice', '2 large young Thai coconuts (also called white coconuts), outside husk cut away, cracked open with hammer, drained', '1 1/2 cups matchstick-size strips peeled carrots (from 2 large)', '1 cup matchstick-size strips red bell pepper', '1 cup mung bean sprouts', '1/2 cup matchstick-size strips seeded English hothouse cucumber', '1/4 cup slivered fresh basil', 'Fresh cilantro sprigs']"
Perfect Pizza Dough,"['1 14 ounces package dry yeast', '1 cup water (105-115 degrees)', '3 12 cups flour', '1 teaspoon salt', '3 tablespoons olive oil', 'cornmeal', '1 tablespoon active dry yeast', '2 tablespoons honey', '2 cups warm water', '1 tablespoon kosher salt', '5 -6 cups all-purpose flour', 'garlic powder', 'oregano', '1 cup very warm water (120-130F)', '12 teaspoon salt', '2 14 teaspoons instant yeast', '3 14-3 12 cups all-purpose flour', '12 teaspoon pure 100% olive oil', '12 cup warm water', '2 teaspoons yeast', '2 cups flour', '250 -350 ml lukewarm water', '1 tablespoon dry active yeast', '550 g strong white flour, plus extra', 'strong white flour, for dusting', '12 teaspoon ground black pepper', '2 teaspoons clear honey', '2 tablespoons extra virgin olive oil, plus extra', 'extra virgin olive oil, for brushing', '5 12 teaspoons sugar', '2 teaspoons kosher salt', '1 tablespoon pure olive oil', '34 cup warm water', '2 cups bread flour', '1 teaspoon instant yeast', '2 teaspoons olive oil', 'olive oil, for pizza crust', 'flour (I used whole wheat flour and found it to be my new favourite(also I do not have a peel and simply us) or cornmeal, for dusting the pizza peel (I used whole wheat flour and found it to be my new favourite(also I do not have a peel and simply us)', '3 ounces your favourite pizza sauce, 1 1/2 oz per per pizza (I just use San Marzano brand crushed tomatoes, drained, with a pinch of salt, a dash of fresh ground)', '12 teaspoon chopped fresh herb (such as thyme or oregano, red pepper flakes, fennel seeds, for example, per pizza)', 'grated cheese (A combination of 3 , such as mozzarella, Monterey Jack, and provolone for just a great cheese pizza)', '1 cup water', '1 teaspoon sugar', '1 (1/4 ounce) package active dry yeast', '3 tablespoons olive oil (plus extra for coating)', '1 12 cups flour (plus extra for dusting)', '1 12 cups bread flour', '14 teaspoon salt', '1 teaspoon fast rising yeast (quick rise)', '12-23 cup lukewarm water', '1 tablespoon olive oil']"
"Luqaimaat , Arab Donuts","['2 12 cups flour', '1 tablespoon yeast', '2 -2 14 cups warm milk', '3 tablespoons yogurt', '3 tablespoons cornflour', '1 teaspoon salt', '1 cup sugar', '12 cup water']"
Cherry Tomatoes in Herb Marinade,"['2 pints cherry tomatoes', 'boiling water', '14 cup red wine vinegar', '2 green onions, sliced (including tops)', '12 teaspoon dry basil', '14 teaspoon oregano leaves', '1 teaspoon garlic salt', '14 teaspoon pepper', '12 cup salad oil (may be part olive oil)']"
Greek Tomato Sauce,"['3 tablespoons olive oil', '1 onion, chopped fine', '1 garlic clove, chopped fine', '4 12 cups chopped tomatoes', '2 tablespoons chopped fresh parsley', '2 teaspoons oregano', '1 cup dry red wine', '8 ounces tomato sauce', '14 teaspoon ground cinnamon', '1 pinch ground allspice', 'fresh ground black pepper, to taste', 'salt, to taste']"
Jerry's Healthy Soup,"['1 quart chicken stock, preferably home made chinese', 'salt', 'white pepper', '1 pinch garlic powder', '1 egg, beaten', '1 (12 ounce) package medium firm tofu, sliced', '1 firm tomatoes, cut in wedges', 'spinach or watercress, torn up', '3 drops sesame oil']"
Mexican Beef Fricassee,"['2 lbs ground beef', '3 potatoes (medium size, diced)', '1 onion (diced)', '2 celery ribs (diced)', '1 green pepper (diced)', '3 cups cabbage (diced)', '2 garlic cloves (minced)', '1 cup salsa (medium heat)', '2 tablespoons olive oil', '34 cup water', '34 cup sour cream', '12 teaspoon salt', '12 teaspoon onion salt', '12 teaspoon garlic salt', '12 teaspoon celery salt', '1 tablespoon chives']"
Maple Walnut Bars,"['1 (18 1/4 ounce) package yellow cake mix, divided', '13 cup butter, melted', '4 eggs, divided', '1 13 cups maple syrup', '13 cup brown sugar, packed', '12 teaspoon vanilla extract', '1 cup chopped walnuts', '2 cups all-purpose flour', '1/2 teaspoon baking soda', '1/2 cup packed brown sugar', '1/2 cup butter', '1 cup real maple syrup', '1 egg', '2 teaspoons vanilla extract', '1 cup ground walnuts', '1/2 cup butter, softened', '2 ounces cream cheese, softened', '1 tablespoon light brown sugar', '3 tablespoons real maple syrup', ""3/8 cup confectioners' sugar"", '1 (18 1/4 ounce) package white cake mix (I used a vanilla)', '12 cup butter, melted', '1 egg, slightly beaten', '34 cup pure maple syrup', '14 cup light brown sugar, firmly packed', '2 eggs', '1 teaspoon vanilla', '1 12 cups walnuts, chopped']"
Orange Raspberry Salad Dressing,"['12 cup orange juice', '14 cup raspberry vinegar', '14 cup olive oil', '1 tablespoon honey', '1 tablespoon Dijon mustard', 'salt & freshly ground black pepper, to taste']"
Dora's Donuts Recipe,"['1 1/2 c. sugar', '1 c. buttermilk', '2 tbsp. butter', '3 Large eggs', '1 teaspoon soda', '1 teaspoon baking pwdr', '1 teaspoon vanilla', '1/2 teaspoon salt']"
Minty Green Bean Salad,"['1/4 cup water', '1 teaspoon white sugar', '1 pound fresh green beans', '4 cloves garlic, thinly sliced', '2 slices onion, chopped', '1 sprig fresh mint leaves', '3 tablespoons olive oil', '1 tablespoon cider vinegar', '1/2 tablespoon minced garlic', '1/4 teaspoon dried basil', '1/4 teaspoon prepared mustard', 'salt and pepper to taste']"
High Protein Strawberry Banana Pancakes,"['1 ripe banana, cut up', '1 cup strawberry yogurt (1 used 3 - 6oz containers so theres bit more then a cup)', '2 eggs', '1 cup cottage cheese', '1 scoop vanilla protein powder (may use banana or natural flavor)', '14 teaspoon baking soda', '14 teaspoon baking powder', '18 teaspoon salt', '3 teaspoons Splenda sugar substitute', '2 cups quick oats', '14 cup Greek yogurt', '3 -4 teaspoons sugar free strawberry jelly']"
Ham & Pea Alfredo Pasta,"['2 cups fresh sliced mushrooms', '1 small onion, diced', '2 garlic cloves, minced', '2 cups cooked ham, cut into 1 inch long strips', '2 cups frozen peas, thawed', '8 ounces cream cheese', '2 cups whipping cream', '1 cup butter', '34 cup grated parmesan cheese']"
Warm Chick Pea and Broccoli Salad,"['1/2 pound (1 heaped cup) dried chick peas, soaked for 6 hours or overnight in 1 quart water', 'Salt, preferably kosher salt, to taste', '1/2 pound broccoli crowns, broken into florets', '1/2 small red onion, sliced optional', '1/4 cup chopped fresh parsley, or a combination of parsley and dill', '2 ounces shaved Parmesan', '1 tablespoon fresh lemon juice', '1 tablespoon red wine vinegar, champagne vinegar, or sherry vinegar', '1 teaspoon Dijon mustard', '1 small garlic clove, minced or put through a press', 'Salt, preferably kosher salt, and freshly ground pepper', 'freshly ground pepper', '6 tablespoons extra virgin olive oil, or 4 tablespoons olive oil and 2 tablespoons buttermilk or plain low-fat or nonfat yogurt']"
Honey Spice-Rubbed Pork Tenderloin,"['1 pork tenderloin (1 lb./450 g) Safeway 1 lb For $3.99 thru 02/09', '1/4 cup Kraft Catalina Dressing, divided', '1 tsp. chili powder', '1 tsp. garlic powder', '1 tsp. dry mustard', '1/2 tsp. paprika', '1/4 tsp. dried thyme leaves', '1 Tbsp. honey', '14 cup Catalina dressing, divided', '1 (1 lb) pork tenderloin', '1 teaspoon chili powder', '1 teaspoon garlic powder', '1 teaspoon dry mustard', '12 teaspoon paprika', '14 teaspoon dried thyme leaves', '1 tablespoon honey', '1 pork tenderloin (1 lb.)', '1/4 cup KRAFT Classic CATALINA Dressing, divided', '1 pork tenderloin (1 lb.) Safeway 1 lb For $3.99 thru 02/09']"
Layered Burrito Bake,"[""1 lb. (450 g) extra-lean ground beef King Sooper's 1 lb For $3.99 thru 02/09"", '1 each red pepper, large carrot and large onion, chopped', '2 cloves garlic, minced', '1 can (28 fl oz/796 mL) no-salt-added diced tomatoes, undrained', '2 cups salsa', '1 cup frozen corn', '1 Tbsp. (about 1/4 of 35-g pkg.) taco seasoning mix', '6 large flour tortillas, cut in half', '1 can (19 fl oz/546 mL) refried beans, divided', '2 cups Cracker Barrel Shredded Tex Mex Cheese, divided', ""1 lb. extra-lean ground beef King Sooper's 1 lb For $3.99 thru 02/09"", '2 cans (14.5 oz. each) no-salt-added diced tomatoes, undrained', '2 cups TACO BELL Thick & Chunky Salsa', '1 tsp. ground cumin', '6 flour tortillas (8 inch), cut in half', '1 can (16 oz.) TACO BELL Refried Beans', '1 pkg. (8 oz.) KRAFT Mexican Style Shredded Four Cheese with a TOUCH OF PHILADELPHIA', '1 lb. extra-lean ground beef Safeway 1 lb For $3.99 thru 02/09', '1 can (16 oz.) refried beans']"
Grilled Spicy Chicken Sandwiches,"['4 boneless skinless chicken breasts', '14 teaspoon salt', '14 teaspoon pepper', '4 slices monterey jack cheese', '12 cup peach preserves', '14 teaspoon crushed red pepper flakes', '8 crusty french dinner rolls', 'lettuce leaf, if desired (optional)']"
Pickled Bread-And-Butter Zucchini,"['16 cups zucchini sliced', '4 cups onions thinly sliced', '1/2 cup pickling salt', '4 cups vinegar', '2 cups sugar', '4 tablespoons mustard seeds', '2 tablespoons celery seeds', '2 teaspoons turmeric ground']"
Low-Fat Low-Calorie Cheese Sauce,"['4 ounces light vanilla soymilk', '3 ounces fat-free cheddar cheese', '2 wedges the Laughing Cow cheese, Light Original Swiss', '2 tablespoons fat free cream cheese']"
Earl Grey Iced Tea,"['1 cup sugar', '1 cup water', '5 cups water', '5 Earl Grey tea bags', '4 dried or fresh lemon slices, plus extra for garnish', 'Ice', 'Sparkling water']"
Bacon Wrapped Jalapeno Popper Stuffed Pork Chops,"['6 ounces, weight Cream Cheese, At Room Temperature', '1 cup Shredded Cheddar Cheese', '4 whole Jalapenos, Diced', '4 Center Cut Boneless Pork Chops, Fat Trimmed Off', 'Salt And Pepper', '8 slices Bacon, Or 2 Per Chop', '1 cup BBQ Sauce']"
Sausage Baked Beans,"['1 pound Dry Navy Beans', '12 cups Fresh Water', '1 whole Bay Leaf', '1 whole Cooking Onion, Peeled', '1/4 pounds Spicy Link Sausage', '1/2 cups Molasses', '1 Tablespoon Brown Sugar', '1 teaspoon Dry Mustard Powder (or 1 Tablespoon Prepared Yellow Mustard)', 'Salt And Pepper, to taste', '12 lb spicy bulk sausage', '4 slices bacon', '1 large onion, chopped', '16 ounces butter beans, drained', '16 ounces pork and beans, undrained', '16 ounces kidney beans, drained', '8 ounces tomatoes or 4 ounces tomato sauce', '14 cup brown sugar, packed', '1 tablespoon Worcestershire sauce', '12 teaspoon dry mustard']"
Beef Jerky Biltong Flavouring,"['3 lbs little to no fat beef or 3 lbs game', '14 cup black pepper, coarsley ground', '14 cup coriander, coarsley ground', '14 cup normal table salt', '14 cup brown sugar', '1 (8 ounce) bottle vinegar']"
Cafe Rio Chicken Salad,"['2 12 lbs chicken, fat trimmed', '1 (2/3 ounce) package Italian salad dressing mix', '1 tablespoon cumin', '1 tablespoon chili powder', '14 cup oil', '12 cup water', '1 teaspoon garlic powder', '14 cup green enchilada sauce', '1 cup rice', '2 cups water', '2 teaspoons chicken bouillon granules or 2 chicken bouillon cubes', '1 tablespoon lime juice', '14 teaspoon salt', '12 cup cilantro, finely chopped', '2 (15 1/4 ounce) cans black beans, undrained', '1 cup green enchilada sauce', '18 cup diced green chilis', '1 12 teaspoons lime juice', '2 cups flour tortilla mix', '12 cup warm water', '2 large tomatoes', '1 small red onion', '13 cup chopped fresh cilantro', '1 teaspoon lime juice', '1 (1/2 ounce) packagehidden valley buttermilk salad dressing mix', '1 cup buttermilk', '1 cup mayonnaise', '2 tomatillos', '12 bunch fresh cilantro', '2 garlic cloves', '12 jalapeno, finely chopped, seeds removed', 'queso fresco', 'corn tortilla strips', 'lettuce']"
Cheese Filled Zucchini,"['6 small zucchini', '15 ounces ricotta cheese', '8 ounces mozzarella cheese, shredded', '12 cup parmesan cheese, shredded and separated', '1 egg, beaten', '1 tablespoon parsley, chopped', '1 dash nutmeg', '1 dash salt', '1 dash pepper', '1 quart spaghetti sauce']"
"Fish Fillets in Caper Sauce, Roman Style","['1 pound white-fleshed saltwater fish fillets, such as sea bass, sole, haddock, hake, or orange roughy', 'about 1/2 cup flour for dredging', 'freshly ground white or black pepper to taste', '2 tablespoons unsalted butter', '2 tablespoons extra virgin olive oil', '2 tablespoons small capers, drained', '1/4 cup dry white wine', '2 tablespoons chopped fresh Italian parsley', 'sea salt to taste']"
Chicken in a Sweet & Zesty Raisin Sauce,"['1 tablespoon olive oil (or use cooking spray to reduce fat)', '1 12 lbs boneless skinless chicken breasts', '1 (14 1/2 ounce) can diced tomatoes', '34 cup raisins', '3 tablespoons lemon juice', '3 tablespoons brown sugar or 3 tablespoons brown sugar substitute', '2 teaspoons grated fresh ginger or 12 teaspoon dried ginger', '14 teaspoon cinnamon', '14 teaspoon black pepper']"
Tuna in Tomato-Tarragon Broth,"['6 tuna fillets (about 5 ounces each)', 'Salt and freshly ground black pepper', '1 tablespoon olive oil', '1 cup reduced-sodium vegetable or chicken broth', '1 cup diced Roma tomatoes', '1/4 cup minced shallots', '2 tablespoons freshly chopped tarragon leaves', '1 cup rice, regular or instant, cooked according to package directions', '2 tablespoons butter']"
Southern Fried Chicken With Corn on the Cob,"['1 roasting chicken, about 4 lb., cut into 10 serving pieces', 'kosher salt, to taste, plus', '2 teaspoons kosher salt', 'fresh ground pepper, to taste, plus', '1 teaspoon ground pepper', '2 cups buttermilk', '1 -2 tablespoon Tabasco sauce', '6 cups canola oil', '1 12 cups all-purpose flour', '12 teaspoon paprika', '4 ears corn, shucked and boiled until tender']"
Heinz 57 Sauce,"['1 12 cups sultana raisins', '1 12 cups water', '3 cups white vinegar', '3 cups malt vinegar', '3 cups tomato paste', '3 cups sugar', '2 tablespoons apple juice', '1 12 tablespoons pickling salt', '3 teaspoons vegetable oil', '3 teaspoons lemon juice', '1 12 teaspoons onion powder', '34 teaspoon garlic powder', '12 teaspoon turmeric', '18 teaspoon celery seed', '2 pinches cayenne pepper', '1 cup malt vinegar', '1 12 cups prepared yellow mustard']"
Marshmallow-Chocolate Truffles,"['20 Jet-Puffed Marshmallows', ""1 pkg. (170 g) Baker's Bittersweet Chocolate, melted"", '1/4 cup multi-coloured sprinkles']"
"Beef Stroganoff, As I Like It!","['800 g beef (fillet)', '4 shallots', '100 g carrots (one large carrot)', '1 bay leaf', '12 teaspoon thyme (dried or fresh)', '50 g onions', '500 ml wine (white, dry)', '100 g butter', '200 g mushrooms (white, cultivated)', '150 g onions', '3 tablespoons brandy', '200 ml wine (white, dry)', '150 g sour cream', '1 lemon (juice from it)', '20 g parsley', '10 g cucumbers (pickled)', '10 g salt', '5 g pepper']"
Houston Junior League Baked Fish,"['12 cup margarine, melted', '2 limes, juice of', 'salt, to taste', 'pepper, to taste', 'garlic clove, pressed, to taste', '3 lbs fish fillets, skinned', '12 cup parmesan cheese', ""6 ounces canned fried onions, in U.S. Durkee and French's make this""]"
Another Tortilla Appetizer Recipe,"['8 ounce Cream cheese, (softened) a little lowfat milk can be added.', '1 sm Can gren chilies', '1/4 c. Picante sauce']"
Chewy Italian Bread,"['2 packages dry yeast', '1/3 cup warm water (105 to 115)', '2 tablespoons sugar, divided', '7 cups all-purpose flour, divided', '2 cups skim milk', '2 tablespoons olive oil', '2 teaspoons salt', 'Vegetable cooking spray', '2 teaspoons water', '1 egg white, lightly beaten', '1 tablespoon poppy seeds or sesame seeds', '14 teaspoon active dry yeast', '14 cup warm water', '34 cup flour', '1 teaspoon active dry yeast', '1 cup ice cold water, divided', '2 34 cups flour, plus', '14 cup more flour, for dusting']"
Asian Glazed Roasted Bacon,"['1/2 pounds Slab Bacon Or Pork Belly (or Other Robust Meat)', '1 teaspoon Sesame Oil (plus Extra If Needed For Searing The Bacon)', '1/2 teaspoons Red Pepper Flakes', '1/2 teaspoons Cardamom Seeds', '1/4 teaspoons Yellow Mustard Seeds', '6 whole Cloves', '1 whole Star Anise', '1 whole Cinnamon Stick, Broken Into Small Pieces', '1 piece Fresh Ginger (about 2"" Long), Chopped', '4 cloves Garlic, Peeled And Smashed', '1/4 cups Soy Sauce', '1 Tablespoon Rice Vinegar', '1 Tablespoon Mirin', '1 cup Water', '1 cup Dark Brown Sugar', '1 whole Orange, Quartered', '1 whole Green Pepper, Sliced Into Thin Strips', '1 cup Rice']"
Heinz Classic Family Meatloaf,"['1 12 lbs ground beef', '12 cup dry breadcrumbs', '1 egg, slightly beaten', '12 cup chopped onion', '12 cup Heinz ketchup', '12 teaspoon salt', '18 teaspoon pepper']"
Mock Key Lime Pie,"['1 each pie shell (9 inch) or graham crumb crust, (9 or 10inch), baked', '6 each egg yolks', '2 cans milk, sweetened condensed (14 oz each)', '8 ounces lime juice bottled', '1 x food coloring yellow or green optional', '1 x whipped cream']"
Chicken Casserole Ole',"['10 12 ounces cream of mushroom soup (fat free)', '10 12 ounces cream of chicken soup (fat free)', '1 (4 ounce) can diced green chilies', '10 ounces monterey jack cheese, grated', '10 ounces low-fat cheddar cheese, grated', '9 flour tortillas, six inch size cut into bite-size pieces', '3 -4 chicken breasts, skinless, boneless, cooked and cut into bite size pieces', '1 (13 ounce) can evaporated skim milk']"
Fast and Easy Chili,"['1 large onions chopped', '2 tablespoons water', '2 each hot chili peppers', '3 each garlic cloves chopped', '1 can pinto beans', '1 can tomato sauce', '1 cup TVP (Texturized Vegetable Protein)', '1 teaspoon chili powder', '1 lb hamburger meat', '1 (5 ounce) can mushrooms, drained', '1 (10 ounce) can stewed tomatoes, cut to desired size', '1 (10 ounce) can tomato soup, condensed', '3 tablespoons chili powder', '2 tablespoons dried onion', '14 of a large bell pepper (about 1/2-2/3 cup)', '12 cup water', 'salt and pepper', '1 (10 ounce) can beans, drained', '1 lb lean ground beef', '1 (15 ounce) can corn', '1 (15 ounce) can diced tomatoes', '1 (15 ounce) kidney beans (substitute any bean)', '1 (1 1/4 ounce) package chili seasoning mix']"
Easy One Bowl Snickers Cake Bars,"['1 (18 1/4 ounce) package yellow cake mix', '12 cup packed brown sugar', '12 cup butter, melted', '2 eggs', '3 (2 1/8 ounce) Snickers candy bars, chopped']"
Creamed Spinach Casserole,"['6 oz. (3/4 of 8-oz. pkg.) PHILADELPHIA Cream Cheese, softened', '2 pkg. (10 oz. each) frozen chopped spinach, thawed, well drained', '1/4 cup milk', '1/2 tsp. lemon pepper seasoning', '1/3 cup crushed seasoned croutons', '2 bags (9 to 10 oz. each) fresh spinach leaves', '6 oz. (3/4 of 8-oz. pkg.) PHILADELPHIA Neufchatel Cheese, softened', '1/4 cup fat-free milk', '3/4 tsp. lemon pepper seasoning', '2 bags (284g each) fresh spinach leaves, washed, dried', '3/4 cup Philadelphia Light Cream Cheese Product', '1/4 cup skim milk', '3/4 tsp. lemon juice Safeway 4 ct For $5.00 thru 02/09', '2 (10 ounce) packages frozen spinach', '1 (8 ounce) cream cheese, softened', '12 ounces shredded parmesan cheese', '12 teaspoon nutmeg', '14 teaspoon salt', '18 teaspoon pepper', '12 cup unsalted butter, melted', '40 ounces frozen spinach (chopped)', '20 ounces sour cream', ""1 (10 1/2 ounce) can Campbell's Cream of Mushroom Soup"", '1 12 cups sliced mushrooms', '2 tablespoons dill', '1 14 ounces Lipton Onion Soup Mix', '12 cup Pepperidge Farm stuffing', '14 cup parmesan cheese']"
Dilly Beef Sandwiches,"['3 -4 lbs boneless chuck roast, trimmed of most excess fat,and cut in 2 to 3 pieces', '1 teaspoon fresh ground black pepper', '1 (16 ounce) jarwhole dill pickles, undrained', '1 large onion, peeled and cut in 8 wedges', '8 cloves garlic, peeled', '1 -2 tablespoon Worcestershire sauce', 'hamburger buns or kaiser roll, warmed or toasted', 'thinly sliced red onion, and', 'cold hamburger, dill pickle chips as accompaniment', 'barbecue sauce', 'mustard', 'mayonnaise, as desired']"
Cherry and Blueberry Trifle,"['1 (12 ounce) store bought poundcake, broken into pieces', '2 (3 1/2 ounce) packages vanilla instant pudding mix', '3 cups cold milk', '4 ounces cream cheese, softened', '1 (16 ounce) can cherry pie filling', '2 pints fresh blueberries, washed and drained', '1 (8 ounce) container Cool Whip Topping, thawed,divided', '14 cup butterscotch schnapps']"
Baked Ziti With Alfedo Sauce,"['1 (16 ounce) package ziti pasta', '16 ounces ricotta cheese', '2 cups shredded mozzarella cheese', '1 cup shredded cheddar cheese', '1 egg, beaten', '1 (20 ounce) jar spaghetti sauce', '1 (16 ounce) jar alfredo sauce', '14 cup grated parmesan cheese']"
Grilled Portobello Sliders with Bruschetta,"['2 Tablespoons Grapeseed Oil', '2 Tablespoons Canola Oil', '1 pinch Each Of Salt, Dried Parsley And Dried Thyme', '1 clove Garlic, Minced', '6"" Portobello Mushroom Caps', '6 Slider Buns', '3 Roma Tomatoes, Diced', '2 Tablespoons Extra Virgin Olive Oil', '1 Tablespoon Fresh Basil, Chopped', '1/2 teaspoons Balsamic Vinegar', '1 pinch Each Of Salt And Pepper']"
Vitello Alla Zurich (Swiss Veal),"['1 lb veal cutlet, pounded thin medallion size', '14 lb diced veal kidney (optional)', '12 lb fresh mushrooms, sliced', '2 -3 shallots or 1 medium onion', '2 tablespoons olive oil, divided use', '2 tablespoons butter, divided use', '14 cup chopped parsley', '2 garlic cloves, minced', 'dry white wine (1/4 to 1/2 cup)', 'salt and pepper', 'heavy cream, room temp. (1/4 to 1/2 cup)']"
"Chicken Breasts, Southwestern Style","['Juice of 1 lime', '2 tablespoons honey', '1 tablespoon vegetable oil', '1/4 teaspoon salt', 'Freshly ground pepper to taste', '6 large boned and skinned chicken breast halves (about 8 ounces each)', '1 cup finely crushed corn chips or tortilla chips', '1/2 cup Fresh Tomato Salsa (see recipe below) or good-quality purchased tomato salsa', '1/4 cup sour cream', '1 avocado, peeled, pitted, and sliced', 'Lime wedges for garnish', '4 tomatoes, seeded, chopped, and drained', '1/2 cup diced green bell pepper (optional)', '1 1/2 cup chopped yellow onion', '1 tablespoon seeded and minced jalapeno pepper, or 1 tablespoon diced canned chiles, drained', '2 garlic cloves, minced', 'Juice of 1 small lime', '1 tablespoon olive oil', '1/4 cup chopped fresh cilantro or parsley', '1 tablespoon chopped fresh oregano or 3/4 teaspoon dried oregano', '1/2 teaspoon salt']"
Resolution Stew,"['1 lb stew meat, cut into 1 inch chunks', '1 cup wine (I used white)', '2 cups beef stock (I used OXO powder)', '1 cup water', '3 bay leaves', '1 tablespoon steak spice', '1 tablespoon herbs, de provence', '1 teaspoon salt', 'pepper', ""1 cup pumpkin puree (I used fresh. If you use canned, you may need a little less because it's more concentrated)"", 'vegetables, of your choice']"
Minted Summer Fruit Spongecakes,"['2 large eggs', '1/3 cup sugar', '1/3 cup all-purpose flour', '1 tablespoon cornstarch', '3 tablespoons unsalted butter, melted and cooled slightly', '1 pint blackberries, washed and shaken dry', '1 mango, pitted and cut into 3/4-inch chunks', '2 tablespoons fresh lemon juice', '3 to 4 tablespoons sugar', '1/4 cup packed mint leaves, thinly sliced', 'Sour cream, for garnish']"
